{
  "record_id": "0a1b2c3d-4e5f-6a7b-8c9d-0e1f2a3b4c5d",
  "problem_id": "c3d4e5f6-a7b8-4c9d-0e1f-2a3b4c5d6e7f",
  "comparison_id": "f6a7b8c9-d0e1-4f2a-3b4c-5d6e7f8a9b0c",
  "schema_version": "v1.0.0",
  "created_at": "2026-10-24T05:48:30Z",
  "selected_scenario_id": "d4e5f6a7-b8c9-4d0e-1f2a-3b4c5d6e7f8a",
  "authorization_state": "AUTHORIZED",
  "human_review_log": {
    "operator_id": "OP-9842",
    "operator_role": "SENIOR_GRID_CONTROLLER",
    "review_timestamp": "2026-10-24T05:48:10Z",
    "rationale_for_selection": "Selected STRAT-HYDRO-REDISPATCH-AND-CURTAIL to preserve trauma centre feed and retain battery reserves for forecast secondary storm cells.",
    "overridden_recommendation": false,
    "override_justification": ""
  },
  "dual_control_signatures": {
    "primary_sign_off": {
      "user_id": "USER-DISPATCH-LEAD-44",
      "user_name": "Arun Sharma",
      "role": "LEAD_DISPATCHER",
      "timestamp": "2026-10-24T05:48:15Z",
      "digital_signature": "ecdsa:304502210089aef41b67c845b9812984ef113ac2e765bd874134812f84cb40928bf45812a0"
    },
    "secondary_sign_off": {
      "user_id": "USER-SAFETY-CHIEF-12",
      "user_name": "Dr. Sunita Rao",
      "role": "EMERGENCY_OPERATIONS_DIRECTOR",
      "timestamp": "2026-10-24T05:48:25Z",
      "digital_signature": "ecdsa:304602210098df447812bc654ef098231aa77b5432ec4178521ab89311fe5283401faec200"
    }
  },
  "operational_dispatch_status": "EXPORTED_TO_OPERATIONS",
  "audit_trail": {
    "record_hash": "sha256:d8e8fca2dc0f896fd7cb4cb0031ba249000a20bf7d5f470a1a5b828ef06cf2a8",
    "previous_record_hash": "sha256:0000000000000000000000000000000000000000000000000000000000000000",
    "signature_algorithm": "ECDSA-P256-SHA256"
  }
}
